{
    "$schema": "../../src/schemas/draft/2022-06/cnccodes.schema.json",
    "type": "mcode",
    "machineType": "mill",
    "title": "M Code Milling Reference",
    "codes": {
        "M00": {
            "category": "mcode",
            "shortDesc": "Program Stop",
            "desc": "Program Stop"
        }
    }
}
