{
    "$schema": "../../src/schemas/draft/2022-06/cnccodes.schema.json",
    "type": "gcode",
    "machineType": "mill",
    "title": "G Code Milling Reference",
    "variant": "brdgeprt",
    "codes": {
        "G00": {
            "category": "motion",
            "shortDesc": "Rapid Motion Positioning",
            "desc": "G00 is used to move the machine axes at the maximum speed. This G code is modal.",
            "modal": true,
            "parameters": {
                "X": {
                    "shortDesc": "X-Axis motion command",
                    "optional": true
                },
                "Y": {
                    "shortDesc": "Y-Axis motion command",
                    "optional": true
                },
                "Z": {
                    "shortDesc": "Z-Axis motion command",
                    "optional": true
                }
            }
        }
    }
}
